"token","freq"
"’m waiting hear back",2
"achieving greater speedaccuracy air",2
"ap — new york",2
"average hours per year",2
"bus hazing took place",2
"cards cookies blog hop",2
"center god’s will purpose",2
"christmas cards cookies blog",2
"don’t want see man",2
"ending mar rs lacs",2
"enter many times like",2
"entering sixth seventhgraders july",2
"focused achieving greater speedaccuracy",2
"forward player massachusetts overall",2
"fourstar prospect small forward",3
"general manager tom heckert",2
"gun technology focused achieving",2
"happy cinco de mayo",2
"help us get followers",2
"hours per year school",2
"i really really really",2
"just four years ago",2
"kid charlie chocolate factory",2
"lacs quarter ending mar",4
"like kid charlie chocolate",2
"mar rs lacs quarter",2
"math scores spent average",2
"may enter many times",2
"million cents per share",2
"minister lee hsien loong",2
"modern art new york",2
"museum modern art new",2
"need tail need tail",4
"new york new jersey",2
"nhl commissioner gary bettman",2
"oven preheat oven degrees",2
"paintball gun technology focused",2
"paintball rifle airsoft weapon",2
"player massachusetts overall rating",2
"please please please please",6
"pm yrs july pm",2
"preheat oven degrees f",2
"prime minister lee hsien",2
"prospect small forward player",3
"quarter ending mar rs",2
"realistic paintball rifle airsoft",2
"relationship son jesus christ",2
"rs lacs quarter ending",4
"san diego san diego",2
"scores spent average hours",2
"sixth seventhgraders july entering",2
"small forward player massachusetts",2
"spent average hours per",2
"state department environmental protection",2
"tail need tail need",2
"take time think goals",2
"technology focused achieving greater",2
"thing works don’t get",2
"via relationship son jesus",2
"wait come back frame",2
"war one another sometimes",2
"will take place pm",3
"you may enter many",2
"yrs july pm yrs",2
